search_place,station,brand,street,city_state_zip,regular_price,regular_price_date,regular_price_time,diesel_price,diesel_price_date,diesel_price_time,services
Quakertown,SUNOCO,Sunoco,2099 QUAKER POINTE DR,"Quakertown , PA",$4.099,Apr 06,07:52 AM,,,,"Restaurant/Deli/Fast Food, Convenience Store/Grocery Store"
Quakertown,TOP STAR #104,Top Star,2030 JOHN FRIES HWY,"Quakertown, PA",$4.139,Apr 06,07:11 AM,$5.999,Apr 06,07:31 AM,"Restaurant/Deli/Fast Food, Bio-Fuels, Convenience Store/Grocery Store"
Quakertown,WAWA #8021,Wawa,1960 JOHN FRIES HWY,"Quakertown, PA",$4.139,Apr 06,07:52 AM,$5.999,Apr 06,07:00 AM,"Open 24 Hours, Convenience Store/Grocery Store"
Quakertown,US GAS,Unbranded,530 E BROAD ST,"Quakertown , PA",$4.159,Apr 06,07:35 AM,,,,"Bio-Fuels, Convenience Store/Grocery Store"
Quakertown,SPEEDWAY #6733,Speedway,140 S WEST END BLVD,"Quakertown , PA",$4.159,Apr 06,06:58 AM,$5.999,Apr 06,05:34 AM,"Open 24 Hours, Restaurant/Deli/Fast Food, Bio-Fuels, Convenience Store/Grocery Store"
Quakertown,GIANT #6476,Giant (Ahold),1465 W BROAD ST,"Quakertown , PA",$4.159,Apr 06,06:10 AM,,,,Convenience Store/Grocery Store
Quakertown,WAWA #272,Wawa,1095 S WEST END BLVD,"Quakertown, PA",$4.159,Apr 06,07:46 AM,$5.999,Apr 06,05:23 AM,"Open 24 Hours, Convenience Store/Grocery Store, Restaurant/Deli/Fast Food"
Quakertown,WAWA #8044,Wawa,600 N WEST END BLVD,"Quakertown, PA",$4.159,Apr 06,07:17 AM,$5.999,Apr 06,07:54 AM,"Open 24 Hours, Restaurant/Deli/Fast Food, Convenience Store/Grocery Store"
Quakertown,A PLUS MINI MARKET,A Plus,331 W BROAD ST,"Quakertown , PA",$4.199,Apr 05,07:57 AM,,,,"Bio-Fuels, Convenience Store/Grocery Store"
