search_place,station,brand,street,city_state_zip,regular_price,regular_price_date,regular_price_time,diesel_price,diesel_price_date,diesel_price_time,services
Quakertown,US GAS,Unbranded,530 E BROAD ST,"Quakertown , PA",$3.999,Jul 09,01:32 PM,,,,"Bio-Fuels, Convenience Store/Grocery Store"
Quakertown,SPEEDWAY #6733,Speedway,140 S WEST END BLVD,"Quakertown , PA",$3.999,Jul 09,12:39 PM,$5.159,Jul 09,11:15 AM,"Open 24 Hours, Restaurant/Deli/Fast Food, Bio-Fuels, Convenience Store/Grocery Store"
Quakertown,GIANT #6476,Giant (Ahold),1465 W BROAD ST,"Quakertown , PA",$3.999,Jul 09,11:52 AM,,,,Convenience Store/Grocery Store
Quakertown,WAWA #272,Wawa,1095 S WEST END BLVD,"Quakertown, PA",$3.999,Jul 09,01:55 PM,$5.149,Jul 09,09:39 AM,"Open 24 Hours, Convenience Store/Grocery Store, Restaurant/Deli/Fast Food"
Quakertown,WAWA #8044,Wawa,600 N WEST END BLVD,"Quakertown, PA",$3.999,Jul 09,01:54 PM,$5.199,Jul 09,01:13 PM,"Open 24 Hours, Restaurant/Deli/Fast Food, Convenience Store/Grocery Store"
Quakertown,TOP STAR #104,Top Star,2030 JOHN FRIES HWY,"Quakertown, PA",$3.999,Jul 09,01:38 PM,$5.099,Jul 09,11:58 AM,"Restaurant/Deli/Fast Food, Bio-Fuels, Convenience Store/Grocery Store"
Quakertown,WAWA #8021,Wawa,1960 JOHN FRIES HWY,"Quakertown, PA",$3.999,Jul 09,01:56 PM,$5.199,Jul 09,01:28 PM,"Open 24 Hours, Convenience Store/Grocery Store"
Quakertown,SUNOCO,Sunoco,2099 QUAKER POINTE DR,"Quakertown , PA",$3.999,Jul 09,01:15 PM,,,,"Restaurant/Deli/Fast Food, Convenience Store/Grocery Store"
Quakertown,A PLUS MINI MARKET,A Plus,331 W BROAD ST,"Quakertown , PA",$4.099,Jul 09,11:51 AM,$5.379,Jul 09,01:20 PM,"Bio-Fuels, Convenience Store/Grocery Store"
