search_place,station,brand,street,city_state_zip,regular_price,regular_price_date,regular_price_time,diesel_price,diesel_price_date,diesel_price_time,services
Quakertown,A PLUS MINI MARKET,A Plus,331 W BROAD ST,"Quakertown , PA",$3.999,Jul 09,06:40 AM,$5.379,Jul 07,09:43 PM,"Bio-Fuels, Convenience Store/Grocery Store"
Quakertown,US GAS,Unbranded,530 E BROAD ST,"Quakertown , PA",$3.999,Jul 08,02:46 PM,,,,"Bio-Fuels, Convenience Store/Grocery Store"
Quakertown,SPEEDWAY #6733,Speedway,140 S WEST END BLVD,"Quakertown , PA",$3.999,Jul 09,06:55 AM,$5.159,Jul 08,09:15 PM,"Open 24 Hours, Restaurant/Deli/Fast Food, Bio-Fuels, Convenience Store/Grocery Store"
Quakertown,GIANT #6476,Giant (Ahold),1465 W BROAD ST,"Quakertown , PA",$3.999,Jul 09,06:10 AM,,,,Convenience Store/Grocery Store
Quakertown,WAWA #272,Wawa,1095 S WEST END BLVD,"Quakertown, PA",$3.999,Jul 09,07:55 AM,$5.149,Jul 09,06:50 AM,"Open 24 Hours, Convenience Store/Grocery Store, Restaurant/Deli/Fast Food"
Quakertown,WAWA #8044,Wawa,600 N WEST END BLVD,"Quakertown, PA",$3.999,Jul 09,07:40 AM,$5.139,Jul 08,06:13 PM,"Open 24 Hours, Restaurant/Deli/Fast Food, Convenience Store/Grocery Store"
Quakertown,TOP STAR #104,Top Star,2030 JOHN FRIES HWY,"Quakertown, PA",$3.999,Jul 09,07:47 AM,$5.099,Jul 09,07:51 AM,"Restaurant/Deli/Fast Food, Bio-Fuels, Convenience Store/Grocery Store"
Quakertown,WAWA #8021,Wawa,1960 JOHN FRIES HWY,"Quakertown, PA",$3.999,Jul 09,07:53 AM,$5.099,Jul 09,07:46 AM,"Open 24 Hours, Convenience Store/Grocery Store"
Quakertown,SUNOCO,Sunoco,2099 QUAKER POINTE DR,"Quakertown , PA",$3.999,Jul 09,06:13 AM,,,,"Restaurant/Deli/Fast Food, Convenience Store/Grocery Store"
