search_place,station,brand,street,city_state_zip,regular_price,regular_price_date,regular_price_time,diesel_price,diesel_price_date,diesel_price_time,services
Quakertown,SUNOCO,Sunoco,2099 QUAKER POINTE DR,"Quakertown , PA",$4.099,Apr 06,06:19 PM,,,,"Restaurant/Deli/Fast Food, Convenience Store/Grocery Store"
Quakertown,TOP STAR #104,Top Star,2030 JOHN FRIES HWY,"Quakertown, PA",$4.139,Apr 06,04:08 PM,$5.999,Apr 06,07:34 PM,"Restaurant/Deli/Fast Food, Bio-Fuels, Convenience Store/Grocery Store"
Quakertown,WAWA #8021,Wawa,1960 JOHN FRIES HWY,"Quakertown, PA",$4.139,Apr 06,07:27 PM,$5.999,Apr 06,07:25 PM,"Open 24 Hours, Convenience Store/Grocery Store"
Quakertown,QUAKERTOWN FOOD MART,Unbranded,1610 N OLD BETHLEHEM PIKE,"Quakertown , PA",$4.149,Apr 06,05:28 PM,,,,Convenience Store/Grocery Store
Quakertown,US GAS,Unbranded,530 E BROAD ST,"Quakertown , PA",$4.159,Apr 06,12:15 PM,,,,"Bio-Fuels, Convenience Store/Grocery Store"
Quakertown,SPEEDWAY #6733,Speedway,140 S WEST END BLVD,"Quakertown , PA",$4.159,Apr 06,07:40 PM,$5.999,Apr 06,01:34 PM,"Open 24 Hours, Restaurant/Deli/Fast Food, Bio-Fuels, Convenience Store/Grocery Store"
Quakertown,GIANT #6476,Giant (Ahold),1465 W BROAD ST,"Quakertown , PA",$4.159,Apr 06,06:00 PM,,,,Convenience Store/Grocery Store
Quakertown,WAWA #272,Wawa,1095 S WEST END BLVD,"Quakertown, PA",$4.159,Apr 06,07:46 PM,$5.999,Apr 06,04:00 PM,"Open 24 Hours, Convenience Store/Grocery Store, Restaurant/Deli/Fast Food"
Quakertown,WAWA #8044,Wawa,600 N WEST END BLVD,"Quakertown, PA",$4.159,Apr 06,07:55 PM,$5.999,Apr 06,04:00 PM,"Open 24 Hours, Restaurant/Deli/Fast Food, Convenience Store/Grocery Store"
Quakertown,A PLUS MINI MARKET,A Plus,331 W BROAD ST,"Quakertown , PA",$4.199,Apr 06,06:35 PM,$5.999,Apr 06,05:31 PM,"Bio-Fuels, Convenience Store/Grocery Store"
