search_place,station,brand,street,city_state_zip,regular_price,regular_price_date,regular_price_time,diesel_price,diesel_price_date,diesel_price_time,services
Quakertown,WAWA #272,Wawa,1095 S WEST END BLVD,"Quakertown, PA",$4.039,Jun 15,01:31 PM,$5.449,Jun 15,01:49 PM,"Open 24 Hours, Convenience Store/Grocery Store, Restaurant/Deli/Fast Food"
Quakertown,SPEEDWAY #6733,Speedway,140 S WEST END BLVD,"Quakertown , PA",$4.059,Jun 15,12:48 PM,$5.459,Jun 15,11:16 AM,"Open 24 Hours, Restaurant/Deli/Fast Food, Bio-Fuels, Convenience Store/Grocery Store"
Quakertown,WAWA #8021,Wawa,1960 JOHN FRIES HWY,"Quakertown, PA",$4.079,Jun 15,01:53 PM,$5.409,Jun 15,01:27 PM,"Open 24 Hours, Convenience Store/Grocery Store"
Quakertown,GIANT #6476,Giant (Ahold),1465 W BROAD ST,"Quakertown , PA",$4.099,Jun 15,11:00 AM,,,,Convenience Store/Grocery Store
Quakertown,WAWA #8044,Wawa,600 N WEST END BLVD,"Quakertown, PA",$4.099,Jun 15,01:41 PM,$5.449,Jun 15,01:09 PM,"Open 24 Hours, Restaurant/Deli/Fast Food, Convenience Store/Grocery Store"
Quakertown,TOP STAR #104,Top Star,2030 JOHN FRIES HWY,"Quakertown, PA",$4.139,Jun 15,01:54 PM,$5.419,Jun 15,01:52 PM,"Restaurant/Deli/Fast Food, Bio-Fuels, Convenience Store/Grocery Store"
Quakertown,SUNOCO,Sunoco,2099 QUAKER POINTE DR,"Quakertown , PA",$4.139,Jun 15,01:32 PM,,,,"Restaurant/Deli/Fast Food, Convenience Store/Grocery Store"
Quakertown,A PLUS MINI MARKET,A Plus,331 W BROAD ST,"Quakertown , PA",$4.159,Jun 15,01:53 PM,,,,"Bio-Fuels, Convenience Store/Grocery Store"
