search_place,station,brand,street,city_state_zip,regular_price,regular_price_date,regular_price_time,diesel_price,diesel_price_date,diesel_price_time,services
Quakertown,A PLUS MINI MARKET,A Plus,331 W BROAD ST,"Quakertown , PA",$4.179,Jun 09,01:03 PM,$5.779,Jun 09,01:46 PM,"Bio-Fuels, Convenience Store/Grocery Store"
Quakertown,WAWA #272,Wawa,1095 S WEST END BLVD,"Quakertown, PA",$4.179,Jun 09,01:52 PM,$5.489,Jun 09,07:46 AM,"Open 24 Hours, Convenience Store/Grocery Store, Restaurant/Deli/Fast Food"
Quakertown,SPEEDWAY #6733,Speedway,140 S WEST END BLVD,"Quakertown , PA",$4.199,Jun 09,01:20 PM,$5.499,Jun 09,11:15 AM,"Open 24 Hours, Restaurant/Deli/Fast Food, Bio-Fuels, Convenience Store/Grocery Store"
Quakertown,GIANT #6476,Giant (Ahold),1465 W BROAD ST,"Quakertown , PA",$4.199,Jun 09,01:30 PM,,,,Convenience Store/Grocery Store
Quakertown,WAWA #8044,Wawa,600 N WEST END BLVD,"Quakertown, PA",$4.199,Jun 09,01:41 PM,$5.459,Jun 09,01:40 PM,"Open 24 Hours, Restaurant/Deli/Fast Food, Convenience Store/Grocery Store"
Quakertown,TOP STAR #104,Top Star,2030 JOHN FRIES HWY,"Quakertown, PA",$4.199,Jun 09,12:24 PM,$5.479,Jun 09,01:21 PM,"Restaurant/Deli/Fast Food, Bio-Fuels, Convenience Store/Grocery Store"
Quakertown,WAWA #8021,Wawa,1960 JOHN FRIES HWY,"Quakertown, PA",$4.199,Jun 09,01:44 PM,$5.459,Jun 09,11:19 AM,"Open 24 Hours, Convenience Store/Grocery Store"
Quakertown,SUNOCO,Sunoco,2099 QUAKER POINTE DR,"Quakertown , PA",$4.199,Jun 09,01:09 PM,,,,"Restaurant/Deli/Fast Food, Convenience Store/Grocery Store"
