search_place,station,brand,street,city_state_zip,regular_price,regular_price_date,regular_price_time,diesel_price,diesel_price_date,diesel_price_time,services
Quakertown,A PLUS MINI MARKET,A Plus,331 W BROAD ST,"Quakertown , PA",$4.179,Jun 08,06:32 PM,$5.779,Jun 08,08:33 PM,"Bio-Fuels, Convenience Store/Grocery Store"
Quakertown,WAWA #272,Wawa,1095 S WEST END BLVD,"Quakertown, PA",$4.179,Jun 09,01:54 AM,$5.489,Jun 08,07:48 PM,"Open 24 Hours, Convenience Store/Grocery Store, Restaurant/Deli/Fast Food"
Quakertown,SPEEDWAY #6733,Speedway,140 S WEST END BLVD,"Quakertown , PA",$4.199,Jun 08,09:15 PM,$5.499,Jun 08,09:15 PM,"Open 24 Hours, Restaurant/Deli/Fast Food, Bio-Fuels, Convenience Store/Grocery Store"
Quakertown,GIANT #6476,Giant (Ahold),1465 W BROAD ST,"Quakertown , PA",$4.199,Jun 08,07:25 PM,,,,Convenience Store/Grocery Store
Quakertown,WAWA #8044,Wawa,600 N WEST END BLVD,"Quakertown, PA",$4.199,Jun 08,09:05 PM,$5.499,Jun 08,08:04 PM,"Open 24 Hours, Restaurant/Deli/Fast Food, Convenience Store/Grocery Store"
Quakertown,TOP STAR #104,Top Star,2030 JOHN FRIES HWY,"Quakertown, PA",$4.199,Jun 08,05:52 PM,$5.499,Jun 08,06:33 PM,"Restaurant/Deli/Fast Food, Bio-Fuels, Convenience Store/Grocery Store"
Quakertown,WAWA #8021,Wawa,1960 JOHN FRIES HWY,"Quakertown, PA",$4.199,Jun 09,01:39 AM,$5.479,Jun 08,08:32 PM,"Open 24 Hours, Convenience Store/Grocery Store"
Quakertown,SUNOCO,Sunoco,2099 QUAKER POINTE DR,"Quakertown , PA",$4.199,Jun 08,07:22 PM,,,,"Restaurant/Deli/Fast Food, Convenience Store/Grocery Store"
