search_place,station,brand,street,city_state_zip,regular_price,regular_price_date,regular_price_time,diesel_price,diesel_price_date,diesel_price_time,services
Quakertown,GIANT #6476,Giant (Ahold),1465 W BROAD ST,"Quakertown , PA",$4.299,May 31,06:00 PM,,,,Convenience Store/Grocery Store
Quakertown,WAWA #8044,Wawa,600 N WEST END BLVD,"Quakertown, PA",$4.299,Jun 01,12:45 AM,$5.699,May 31,04:00 PM,"Open 24 Hours, Restaurant/Deli/Fast Food, Convenience Store/Grocery Store"
Quakertown,WAWA #272,Wawa,1095 S WEST END BLVD,"Quakertown, PA",$4.339,Jun 01,12:35 AM,$5.759,Jun 01,12:34 AM,"Open 24 Hours, Convenience Store/Grocery Store, Restaurant/Deli/Fast Food"
Quakertown,SPEEDWAY #6733,Speedway,140 S WEST END BLVD,"Quakertown , PA",$4.359,May 31,09:15 PM,$5.759,May 31,09:15 PM,"Open 24 Hours, Restaurant/Deli/Fast Food, Bio-Fuels, Convenience Store/Grocery Store"
Quakertown,WAWA #8021,Wawa,1960 JOHN FRIES HWY,"Quakertown, PA",$4.359,May 31,11:44 PM,$5.779,Jun 01,12:36 AM,"Open 24 Hours, Convenience Store/Grocery Store"
Quakertown,A PLUS MINI MARKET,A Plus,331 W BROAD ST,"Quakertown , PA",$4.399,May 31,07:19 PM,$5.759,May 31,06:24 PM,"Bio-Fuels, Convenience Store/Grocery Store"
Quakertown,US GAS,Unbranded,530 E BROAD ST,"Quakertown , PA",$4.399,May 31,11:46 AM,,,,"Bio-Fuels, Convenience Store/Grocery Store"
Quakertown,SUNOCO,Sunoco,2099 QUAKER POINTE DR,"Quakertown , PA",$4.399,May 31,04:12 PM,,,,"Restaurant/Deli/Fast Food, Convenience Store/Grocery Store"
Quakertown,TOP STAR #104,Top Star,2030 JOHN FRIES HWY,"Quakertown, PA",$4.499,May 31,04:05 PM,$5.799,May 30,01:21 PM,"Restaurant/Deli/Fast Food, Bio-Fuels, Convenience Store/Grocery Store"
