search_place,station,brand,street,city_state_zip,regular_price,regular_price_date,regular_price_time,diesel_price,diesel_price_date,diesel_price_time,services
Richlandtown,SUNOCO,Sunoco,308 N 3RD ST,"Coopersburg, PA",$3.759,Jun 20,10:26 AM,,,,"Open 24 Hours, Restaurant/Deli/Fast Food, Bio-Fuels, Convenience Store/Grocery Store"
Richlandtown,GIANT #6314,Giant (Ahold),216 E FAIRMOUNT ST,"Coopersburg , PA",$3.799,Jun 21,05:45 PM,,,,Convenience Store/Grocery Store
Richlandtown,WAWA #8044,Wawa,600 N WEST END BLVD,"Quakertown, PA",$3.829,Jun 21,04:00 PM,$5.199,Jun 21,04:00 PM,"Open 24 Hours, Restaurant/Deli/Fast Food, Convenience Store/Grocery Store"
Richlandtown,SPEEDWAY #6733,Speedway,140 S WEST END BLVD,"Quakertown , PA",$3.829,Jun 21,09:15 PM,$5.199,Jun 21,09:15 PM,"Open 24 Hours, Restaurant/Deli/Fast Food, Bio-Fuels, Convenience Store/Grocery Store"
Richlandtown,TURKEY HILL MINIT MARKET #950262,Turkey Hill,106 S 3RD ST,"Coopersburg, PA",$3.829,Jun 20,04:49 PM,,,,"Open 24 Hours, Restaurant/Deli/Fast Food, Convenience Store/Grocery Store"
Richlandtown,GIANT #6476,Giant (Ahold),1465 W BROAD ST,"Quakertown , PA",$3.849,Jun 21,05:17 PM,,,,Convenience Store/Grocery Store
Richlandtown,WAWA #272,Wawa,1095 S WEST END BLVD,"Quakertown, PA",$3.859,Jun 21,10:30 PM,$5.249,Jun 21,04:00 PM,"Open 24 Hours, Convenience Store/Grocery Store, Restaurant/Deli/Fast Food"
Richlandtown,Top Star,Top Star,318 S 3RD ST,"Coopersburg, PA",$3.859,Jun 21,05:46 PM,,,,"Restaurant/Deli/Fast Food, Bio-Fuels, Convenience Store/Grocery Store"
Richlandtown,A PLUS MINI MARKET,A Plus,331 W BROAD ST,"Quakertown , PA",$3.939,Jun 21,07:19 PM,,,,"Bio-Fuels, Convenience Store/Grocery Store"
