search_place,station,brand,street,city_state_zip,regular_price,regular_price_date,regular_price_time,diesel_price,diesel_price_date,diesel_price_time,services
Richlandtown,GIANT #6476,Giant (Ahold),1465 W BROAD ST,"Quakertown , PA",$3.999,Apr 14,11:00 AM,,,,Convenience Store/Grocery Store
Richlandtown,WAWA #8044,Wawa,600 N WEST END BLVD,"Quakertown, PA",$3.999,Apr 14,01:30 PM,$5.979,Apr 14,01:47 PM,"Open 24 Hours, Restaurant/Deli/Fast Food, Convenience Store/Grocery Store"
Richlandtown,SPEEDWAY #6733,Speedway,140 S WEST END BLVD,"Quakertown , PA",$3.999,Apr 14,01:47 PM,$5.999,Apr 14,01:26 PM,"Open 24 Hours, Restaurant/Deli/Fast Food, Bio-Fuels, Convenience Store/Grocery Store"
Richlandtown,QUAKERTOWN FOOD MART,Unbranded,1610 N OLD BETHLEHEM PIKE,"Quakertown , PA",$3.999,Apr 13,11:00 AM,,,,Convenience Store/Grocery Store
Richlandtown,WAWA #272,Wawa,1095 S WEST END BLVD,"Quakertown, PA",$3.999,Apr 14,01:20 PM,$5.999,Apr 14,12:41 PM,"Open 24 Hours, Convenience Store/Grocery Store, Restaurant/Deli/Fast Food"
Richlandtown,TURKEY HILL MINIT MARKET #950262,Turkey Hill,106 S 3RD ST,"Coopersburg, PA",$3.999,Apr 14,09:02 AM,,,,"Open 24 Hours, Restaurant/Deli/Fast Food, Convenience Store/Grocery Store"
Richlandtown,GIANT #6314,Giant (Ahold),216 E FAIRMOUNT ST,"Coopersburg , PA",$3.999,Apr 14,12:16 PM,,,,Convenience Store/Grocery Store
Richlandtown,Top Star,Top Star,318 S 3RD ST,"Coopersburg, PA",$4.039,Apr 14,09:40 AM,,,,"Restaurant/Deli/Fast Food, Bio-Fuels, Convenience Store/Grocery Store"
Richlandtown,US GAS,Unbranded,530 E BROAD ST,"Quakertown , PA",$4.059,Apr 12,07:07 PM,,,,"Bio-Fuels, Convenience Store/Grocery Store"
Richlandtown,A PLUS MINI MARKET,A Plus,331 W BROAD ST,"Quakertown , PA",$4.159,Apr 14,01:29 PM,$5.999,Apr 14,08:13 AM,"Bio-Fuels, Convenience Store/Grocery Store"
