search_place,station,brand,street,city_state_zip,regular_price,regular_price_date,regular_price_time,diesel_price,diesel_price_date,diesel_price_time,services
Richlandtown,SPEEDWAY #6733,Speedway,140 S WEST END BLVD,"Quakertown , PA",$4.039,Jun 15,10:50 PM,$5.459,Jun 15,09:15 PM,"Open 24 Hours, Restaurant/Deli/Fast Food, Bio-Fuels, Convenience Store/Grocery Store"
Richlandtown,WAWA #272,Wawa,1095 S WEST END BLVD,"Quakertown, PA",$4.039,Jun 15,09:46 PM,$5.449,Jun 15,09:02 PM,"Open 24 Hours, Convenience Store/Grocery Store, Restaurant/Deli/Fast Food"
Richlandtown,WAWA #8044,Wawa,600 N WEST END BLVD,"Quakertown, PA",$4.079,Jun 15,09:05 PM,$5.399,Jun 15,05:52 PM,"Open 24 Hours, Restaurant/Deli/Fast Food, Convenience Store/Grocery Store"
Richlandtown,TURKEY HILL MINIT MARKET #950262,Turkey Hill,106 S 3RD ST,"Coopersburg, PA",$4.089,Jun 15,04:01 PM,,,,"Open 24 Hours, Restaurant/Deli/Fast Food, Convenience Store/Grocery Store"
Richlandtown,GIANT #6476,Giant (Ahold),1465 W BROAD ST,"Quakertown , PA",$4.099,Jun 15,06:33 PM,,,,Convenience Store/Grocery Store
Richlandtown,GIANT #6314,Giant (Ahold),216 E FAIRMOUNT ST,"Coopersburg , PA",$4.099,Jun 15,06:00 PM,,,,Convenience Store/Grocery Store
Richlandtown,A PLUS MINI MARKET,A Plus,331 W BROAD ST,"Quakertown , PA",$4.159,Jun 15,06:05 PM,,,,"Bio-Fuels, Convenience Store/Grocery Store"
Richlandtown,Top Star,Top Star,318 S 3RD ST,"Coopersburg, PA",$4.199,Jun 15,06:24 PM,,,,"Restaurant/Deli/Fast Food, Bio-Fuels, Convenience Store/Grocery Store"
