search_place,station,brand,street,city_state_zip,regular_price,regular_price_date,regular_price_time,diesel_price,diesel_price_date,diesel_price_time,services
Richlandtown,GIANT #6476,Giant (Ahold),1465 W BROAD ST,"Quakertown , PA",$4.499,May 05,06:10 AM,,,,Convenience Store/Grocery Store
Richlandtown,Top Star,Top Star,318 S 3RD ST,"Coopersburg, PA",$4.499,May 05,07:31 AM,,,,"Restaurant/Deli/Fast Food, Bio-Fuels, Convenience Store/Grocery Store"
Richlandtown,SUNOCO,Sunoco,308 N 3RD ST,"Coopersburg, PA",$4.499,May 05,07:05 AM,$5.799,May 04,03:48 PM,"Open 24 Hours, Restaurant/Deli/Fast Food, Bio-Fuels, Convenience Store/Grocery Store"
Richlandtown,WAWA #8044,Wawa,600 N WEST END BLVD,"Quakertown, PA",$4.699,May 05,07:51 AM,$5.859,May 05,05:24 AM,"Open 24 Hours, Restaurant/Deli/Fast Food, Convenience Store/Grocery Store"
Richlandtown,SPEEDWAY #6733,Speedway,140 S WEST END BLVD,"Quakertown , PA",$4.699,May 05,07:14 AM,$5.859,May 04,09:15 PM,"Open 24 Hours, Restaurant/Deli/Fast Food, Bio-Fuels, Convenience Store/Grocery Store"
Richlandtown,WAWA #272,Wawa,1095 S WEST END BLVD,"Quakertown, PA",$4.699,May 05,07:41 AM,$5.859,May 05,07:51 AM,"Open 24 Hours, Convenience Store/Grocery Store, Restaurant/Deli/Fast Food"
Richlandtown,GIANT #6314,Giant (Ahold),216 E FAIRMOUNT ST,"Coopersburg , PA",$4.699,May 05,06:10 AM,,,,Convenience Store/Grocery Store
Richlandtown,A PLUS MINI MARKET,A Plus,331 W BROAD ST,"Quakertown , PA",$4.799,May 05,07:43 AM,$5.899,May 04,06:04 PM,"Bio-Fuels, Convenience Store/Grocery Store"
